character,dialogue
Owen,"Well, I don't think we'll find much in here."
Buffy,(looks around) That's the plan.
Owen,Okay. (confused) What?
Buffy,"(finished looking) I have to go now. (laughs nervously) Um, to  the bathroom, I have to go to the bathroom. If you hear anything, like a  security guard or something, just be really quiet. (to Willow and  Xander) And barricade the door."
Buffy,"(opens one) Ewww, parts!"
Giles,"Keep looking, he must be here somewhere."
Owen,What are you guys doing?
Willow,"Uh, just in case!"
Owen,"Oh, my!"
Buffy,Nothing.
Giles,The Anointed must be gone.
Buffy,"I guess. I mean, this is where they keep all the dead bodies,  right?"
Giles,Mm-hmm.
Owen,"I read a lot about death, but... but I've... never really seen a  dead body before."
Owen,Do they... usually move?
Andrew,I have been judged!
Owen,What's goin' on?
Buffy,"Oh, no!"
Andrew,(laughs) He is risen in me! He fills my head with song!
Andrew,Pork and beans. Pork and beans!
Xander,(to Willow) Gimme that!
Andrew,I can smell you.
Andrew,"You're the chaff, unblessed. I'll suck the blood from your  hearts, he says I may!"
Xander,He's in there!
Buffy,"Uh, go! Get out!"
Xander,She'll be okay. C'mon!
Andrew,"<I>Shall we gather at the river? / The beautiful, the beautiful  river?</I>"
Willow,I think he's coming this way!
Owen,"Oh, God, this is too much!"
Buffy,What've you got?
Giles,What?
Buffy,What'd you bring? Do you have a stake?
Giles,"Oh, uh... (hands her a stake.)"
Buffy,Thank you! (starts back out the door)
Giles,W-what should I do?
Buffy,"(faces Giles) Um, go outside and make sure the others are okay."
Giles,Buffy!
Owen,Somebody's gotta help Buffy!
Willow,Owen!
Andrew,They told me about you while I was sleeping.
Andrew,Uh! Why does he hurt me?
Owen,Buffy!
Owen,No!
Owen,Did you see that? He tried to bite me! (helps Buffy up) What a  sissy!
Buffy,No!
Andrew,Dead! (lets Owen fall) He was found wanting!
Buffy,You killed my date!
Willow,Buffy! Owen's...
Xander,(pulls Willow back) J-just give her a sec!
Buffy,You killed my date!
Andrew,Your turn!
Owen,Does anyone have an aspirin? Or sixty?
Buffy,(goes to Owen) Owen! (crouches beside him)
Owen,What happened to that guy?
Buffy,Oh... We scared him away.
Owen,"Oh, good. 'Cause, y'know, I would've..."
Buffy,I know. Here... (helps him up) I'm sure this isn't exactly what  you had in mind for our first date.
Owen,(rubs his head) Yeah! I was hoping maybe we'd finish at Ben &  Jerry's.
Buffy,We still could...
Owen,"No, I, I, I think I'll just walk home. (starts to go, but stops)  Uh, which way's home?"
Buffy,I'll get you there.
Owen,"No, I'll, I'll go it alone."
Xander,We'll make sure he gets home safely.
Giles,"Buffy, if I might, uh..."
Buffy,(cuts him off) Don't! (slowly walks out)
Buffy,"Well, did Owen say anything about me on the way home?"
Willow,"Oh, you mean specifically about you?"
Buffy,"Or generally... i-in the area, in the ballpark, any sort of  indication?"
Xander,"Well, in that case, no."
Willow,"But he was pretty incoherent, so we might've missed it."
Buffy,You think?
Xander,No.
Buffy,I knew it. I totally blew it last night!
Xander,"No, see, what you need is a guy who already knows your deepest,  darkest secrets and still says, 'Hey! I like that girl!' Someone like..."
Buffy,(sees Owen) Owen!
Willow,"Well, heh... This is our stop."
Owen,Hi.
Buffy,Hi. (long awkward pause) This is going well.
Owen,"I don't really know how to say this, but... about last night..."
Buffy,You don't even have to. I'm sure you were pretty freaked out.
Owen,Totally. (Buffy looks down) And... I was wondering when I could  see you again.
Buffy,"(looks back up) Um, that was my hopeful ear. Could you repeat  that?"
Owen,I think you're the coolest!
Buffy,(smiles) Really?
Owen,"I mean, last night was incredible! I never thought nearly getting  killed would make me feel so... alive!"
Buffy,(looks down and starts to walk) So that's why you wanna be with  me.
Owen,"(follows her) Oh, absolutely! When can we do something like that  again?"
Buffy,Something like...
Owen,"Like, walk downtown at three in the morning, a-and pick a fight  in a bar. How about tonight?"
Buffy,Tonight would... (they stop walking) be... not a workable thing.  Did I just say that?
Owen,"Tomorrow, then. I-I'm free any night this week."
Buffy,"I'm not. Please don't take this personally. It's not you, it's  me."
Owen,(begins to get it) Right. It's you.
Buffy,And I was kinda hoping that... maybe you and I could still be...
Owen,"(very disappointed) I, I get it. You just wanna be friends."
Buffy,That'd be nice.
Owen,Friends. Yeah. Great. (leaves)
Lyrics,<I>The world will keep on turning / It'll all be there come  morning / So tonight...</I>
Buffy,Yeah. Great.
Lyrics,<I>Let the sun fall down all around you (song by Kim Richey)</I>
Giles,"I was ten years old when my father told me I was destined to be  a Watcher. (sits next to her) He was one, and his, uh, mother before  him, and I was to be next."
Buffy,Were you thrilled beyond all measure?
Giles,"No, I had very definite plans about my future. I was going to be  a fighter pilot. Or possibly a grocer. Well, uh... My father gave me a  very tiresome speech about, uh, responsibility and sacrifice."
Buffy,"Sacrifice, huh?"
Giles,(looks toward Owen) Seems like a nice lad.
Buffy,"Yeah. But he wants to be danger man. You, Xander, Willow, you  guys... you guys know the score, you're careful. Two days in my world  and Owen really *would* get himself killed. Or I'd get him killed.  (faces Giles) Or someone else."
Giles,"I, I went to the funeral home of my own free will."
Buffy,And I should've been there.
Giles,Buffy...
Buffy,I blew it!
Giles,"I have volumes of lore, of prophecies, of predictions. But I  don't have an instruction manual. We feel our way as we go along. And, I  must say, as a Slayer, you're, you're doing... pretty well."
Buffy,(smiles) Well. At least I did stop that prophecy thing from  coming true.
Giles,"You did! Handily. No more Anointed One. And I would imagine the  Master, wherever he is, is having a fairly bad day himself."
Master,"(quotes scripture) 'And in this time will come the Anointed.  And the Slayer will not know him. She will not stop him, and he will  lead her into hell.' (kneels down next to Collin) Welcome, my friend."
