character,dialogue
Buffy,I can't! What am I supposed say? 'Sorry I almost got your throat  slit. What's the homework?'
Giles,Punishing yourself like this is pointless.
Buffy,It's entirely pointy. I was a moron. I put my best friends in  mortal danger on the second day of school.
Giles,What are you gonna do? Crawl inside a cave for the rest of your  life?
Buffy,Would it have cable?
Giles,"Buffy, you acted wrongly, I admit that. But believe me, that was  hardly the, the worst mistake you'll ever make. Uh, that wasn't quite as  comforting as it was meant to be."
Buffy,"Well, points for effort. (the bell rings) See ya."
Willow,"Hey, Buffy."
Buffy,Hey.
Willow,We saved you a seat.
Xander,"There's a rumor going around that, uh, Mr. Cox is the most  boring teacher in the entire world. Like, I think he won a belt or  something."
Buffy,"Like, yes."
Willow,"Well, I hear he nods off a lot. So that's a plus."
Xander,"So, we Bronzin' it tonight?"
Willow,"Wednesday, it's kinda beat."
Xander,"Well, we could grind our enemies into talcum powder with a  sledgehammer, but, gosh, we did that last night."
Xander,"Hey, I got a plan: how 'bout miniature golf."
Willow,There's no course here.
Xander,"Okay, uh, miniature tennis! A very tiny form of tennis that we  could invent..."
Collin,I hate that girl.
