character,dialogue
Angel,I told you. I couldn't make the first move. I had to see if he  was buying it or not.
Xander,"A-and if he bit me, what then?"
Angel,We would've known he bought it.
Xander,"Hey, what's the deal with you being Spike's sire? What's a  sire?"
Chief,I need to say something to the media people.
Snyder,So?
Chief,So? You want the usual story? Gang-related? PCP?
Snyder,What'd you have in mind? The truth?
Chief,(considers) Right. Gang-related. PCP.
Buffy,"So, what did you and Principal Snyder talk about anyway?"
Joyce,Principal Snyder said you were a troublemaker.
Joyce,And I could care less.
Joyce,"I have a daughter who can take care of herself. Who's brave and  resourceful and thinks of others in a crisis. No matter who you hang out  with or what dumb teenage stuff you think you need to do, I'm gonna  sleep better knowing all that."
Buffy,About how long till this wears off and you start ragging on me  again?
Joyce,"Oh, at least a week and a half."
Buffy,Very cool!
Cordelia,"And if you get me out of this, I swear I'll never be mean to  anyone ever again. Unless they *really* deserve it. Or if it's that time  of the month, in which case I don't think you or anyone else can hold me  responsible..."
Willow,Ask for some aspirin.
Cordelia,And can you please send some asp... Hey!
Drusilla,"Spike, did she hurt you?"
Spike,"It was close, baby, but..."
Drusilla,"Oh, come here."
Spike,A Slayer with family and friends. That sure as hell wasn't in  the brochure.
Drusilla,"You'll kill her, and then we'll have a nice celebration."
Spike,"Yeah, a party."
Drusilla,Yeah. With streamers... and songs.
Spike,(lifts his head from her shoulder) How's the annoying one?
Drusilla,He doesn't wanna play.
Spike,"Figures. Well, suppose I better go make nice."
Collin,You failed.
Spike,"I, uh... I offer penance."
Spike,"I was rash, and if I had to do it all over again... (breaks out  in laughter) Who am I kidding? (stands up) I would do it exactly the  same, only I'd do this... (grabs Collin)"
Collin,No!
Spike,...first!
Spike,"From now on, we're gonna have a little less ritual... (stops  pulling the chain) ...and a little more fun around here."
Spike,Let's see what's on TV.
