character,dialogue
Spike,"What if she did? If you ask me, I find myself preferring the old  Buffy-whipped Angelus. This new, improved one is not playing with a full  sack. (gets a look from Angelus) I love a good slaughter as much as the  next bloke, but his little pranks will only leave us with one incredibly  brassed-off Slayer!"
Angelus,"Don't worry, roller boy. I've got everything under control."
Angelus,"Jeez, whatever happened to wooden stakes?"
Spike,Uh-uh. No fair going into the ring unless he tags you first.
Angelus,All right. You've had your fun. But you know what it's time  for now?
Buffy,My fun.
Angelus,Are you gonna let your old man just burn?
Giles,Why did you come here?! This wasn't your fight!
Buffy,Are you trying to get yourself killed?!
Buffy,You can't leave me. I can't do this alone.
Angelus,(narrates) It hurts sometimes more than we can bear.
Angelus,"(narrates) If we could live without passion, maybe we'd know  some kind of peace. But we would be hollow."
Angelus,"(narrates) Empty rooms, shuttered and dank..."
Angelus,"(narrates) Without passion, we'd be truly dead."
Giles,In my years as... Watcher... I've buried... too many people. But  Jenny was the first I've loved.
Buffy,(looks up at him) I'm sorry. I'm sorry I couldn't kill him for  you... (looks down at the grave) for her... when I had the chance.
Buffy,I wasn't ready.
Buffy,(voiceover) But I think I finally am.
Willow,Hi. Principal Snyder asked me to fill in for Ms. Calendar... u- until the new computer science teacher arrives. So I'm just gonna stick  to the lesson plan she left.
Buffy,(narrates) I can't hold on to the past anymore. Angel has gone.  Nothing's ever gonna bring him back.
