character,dialogue
BUFFY,Are you quite finished?
BUFFY,"It's over, okay? I'm going to ignore you, and you're going to go away."
BUFFY,You're really gonna have to get over the whole ... primal power thing. (walks toward the sofa)
BUFFY,(over her shoulder) You're *not* the source of me.
BUFFY,"Also, in terms of hair care, you really wanna say, what kind of impression am I making in the workplace? 'Cause-"
WILLOW,The First Slayer. Wow.
XANDER,Not big with the socialization.
WILLOW,Or the floss.
GILES,"Somehow our joining with ... Buffy and ... invoking the essence of the, the Slayer's power was an affront to the source of that power."
BUFFY,"You know, you could have brought that up to us *before* we did it."
GILES,I did. I said there could be dire consequences.
BUFFY,"Yes, but you say that about chewing too fast."
JOYCE,"I'm, uh, guessing I missed some fun?"
WILLOW,The spirit of the first Slayer tried to kill us in our dreams.
JOYCE,"Oh, you want some hot chocolate?"
JOYCE,Xander?
XANDER,"Yes, what, Joyce? (Nervously) Uh ... Buffy's mom."
JOYCE,"Be my kitchen buddy again, help me carry? (Nods toward the kitchen)"
XANDER,Yes. Sure. (Nervously) Buffy's mom.
Giles,You all right?
BUFFY,Yeah. I think I might jump in the shower.
GILES,"You seem a bit, uh..."
BUFFY,"A little. (Pensive) The First Slayer. I never really thought about it. (Sighs) It was intense. I-I guess you guys got a taste of that, huh."
XANDER,"Yeah, from now on, you keep your Slayer friends out of my dreams. Is that clear?"
WILLOW,It's not good for the sleepin'.
BUFFY,"Ah... (Gets up) Well, at least you all didn't dream about that guy with the cheese. (Walks off.)"
BUFFY,(offscreen) I don't know *where* the hell that came from.
VOICEOVER,You think you know ... what's to come ... what you are. You haven't even begun.
