character,dialogue
BUFFY,(normal voice) That was gross.
DRACULA,You are resisting.
BUFFY,Looks like.
DRACULA,Come here. Come to me. (holds out hand)
BUFFY,"You know, I really think the thrall has gone out of our relationship. But I want to thank you for opening up my eyes a little."
DRACULA,What is this?
BUFFY,My true nature. You want a taste?
RILEY,Buffy? Are you in- (stops himself before falling into the pit) Giles! Giles!
RILEY,"Come on, come on. Grab my hand."
GILES,Thank god you came.
RILEY,Come on!
GILES,There was no possible escape.
GILES,"Oh, my shoe. (Pointing back into the pit) Silly me, I'll just pop-"
RILEY,"No no no, sir! (Pulls him away) No more chick pit for you. Come on. (They get up and move off down the hall.)"
BUFFY,A guy like you should think about going electric. Seriously.
BUFFY,How do you like my darkness now?
RILEY,Buffy! You okay?
BUFFY,Yeah. Chock full of free will.
GILES,And Dracula?
BUFFY,Eurotrashed.
XANDER,(back to talking normally) Where is he?? Where's the creep that turned me into his spider-eating man-bitch?
BUFFY,He's gone.
XANDER,"Dammit! You know what? I'm sick of this crap. I'm sick of being the guy who eats insects and gets the funny syphilis. As of this moment, it's over. I'm finished being everybody's butt-monkey!"
BUFFY,Check. No more butt-monkey.
RILEY,It coulda been worse. At least you weren't making time with the dracu-babes like Giles here.
GILES,"I was not making time! I, I was, uh, just about to kill those, uh, loathsome creatures when Riley interrupted me. (Wrapping his torn shirt around himself)"
GILES,Of course not! I was in complete... (the others have walked off) control.
BUFFY,You think I don't watch your movies? (rolling her eyes) You always come back.
BUFFY VO,I'm standing right here!
BUFFY VO,You wanted to see me?
GILES,Yes. Thanks for coming. Can I offer you some tea?
BUFFY,"Oh ... no, thanks. (notices a plate on the table by the sofa) Ooh, cookies. How come I rate the little cookie treatment?"
GILES,"Well, actually, I have something to tell you. (comes over with a teapot. They both sit on the sofa.)"
BUFFY,"Actually, I have something that I'd like to talk to you about, too."
GILES,"Oh, well, you go first, by all means."
BUFFY,"No, go ahead."
GILES,"No, I insist. (pouring tea)"
BUFFY,"(after a moment, softly) You haven't been my Watcher for a while. (Giles stops pouring) I haven't been training ... and I haven't really needed to come to you for help."
GILES,(sadly) I agree. (sets down the teapot)
BUFFY,"(gestures helplessly, gets up to pace) And then this whole thing with Dracula ... it made me face up to some stuff. (Giles looks concerned) Ever since we did that spell where we called on the first slayer ... I've been going out a lot. (Giles looks surprised) Every night."
GILES,Patrolling?
BUFFY,Hunting. That's ... what Dracula called it. (pacing)  And he was right. He understood my power better than I do. He saw darkness in it.
BUFFY,"(sits down again) I need to know more. About where I come from, about the other slayers. I mean, maybe ... maybe if I could learn to control this thing, I could be stronger, I could be better. But ... I'm scared. I know it's gonna be hard. And I can't do it ... without you. I need your help. (pause) I need you to be my Watcher again."
BUFFY,"(sighs, laughs nervously) Boy, I just, I just keep talking, don't I? I'm sorry, you-you had something you wanted to say?"
GILES,(smiling) No ... it's nothing.
BUFFY,"I'm outta here. (Joyce comes onscreen, in the bedroom. Buffy moves offscreen but keeps talking) Riley and I are going to the movies."
JOYCE,Okay. Have a good time.
<u>BUFFY VO,What are you *doing* here?</u>
JOYCE,"Buffy? If you're going out, why don't you take your sister?"
Buffy and Dawn (in unison),Mom!
Executive Producer,Joss Whedon.
