character,dialogue
RILEY,"(shakes his head) It's not about him. It's about us. (Buffy shakes her head, not understanding) You're getting stronger every day, more powerful. I can't touch you. Every day, you're just ... a little further out of my reach."
BUFFY,You wanna touch me? (walks toward him) I'm right here. I'm not the one running away.
RILEY,Not yet.
BUFFY,So you have this all figured out? I'm bailing because you're not in the super club.
RILEY,(shrugs) It's human nature.
BUFFY,"(angrily) Don't Psych 101 me. (Riley looks away) Not now. Not after everything that ... Nobody has ever known me the way you do. Nobody. (Riley doesn't look at her) I've opened up to you in ways that I've never opened up to ... God, you're just sitting back there thinking that none of this means anything to me."
RILEY,(still not looking at her) I never said that.
BUFFY,(teary-eyed) Because it obviously doesn't mean anything to you. Do you really think so little of me-
RILEY,Buffy.
BUFFY,"No! No. Do you think that I spent the last year with you because you had super powers? If that's what I wanted, then I'd be dating Spike. (quietly) Riley, I need you. (He looks at her, looks apprehensive) I need you with me ... and I need you healthy. But if you wanna throw it all away because you don't trust me, then ... (firmly) then I'm still gonna make you go to that doctor."
RILEY,Take me to him.
BUFFY,We have to hurry.
RILEY,"Loving you is the scariest thing I've ever done, Buffy."
BUFFY,I don't know why.
BUFFY,The doctor said we didn't have much time.
HARMONY,I read in a magazine that some women think a man's real sex organ is his brain.
HARMONY,"Yecch! No contest. I mean, look at it. It's so ... pink and wriggly-looking. (grins suddenly; to the doctor) Can I touch it?"
SPIKE/OVERHEISER,(unison) No!
HARMONY,"(looking over at Spike's face) Oh my god, you're awake?"
OVERHEISER,Local anesthetic.
HARMONY,"Wow, Spikey, how does it feel?"
SPIKE,"Like someone's cutting into my brain with a knife, you silly bint."
HARMONY,(to doctor) You know what it means that he can't hurt any living thing? It means he can't even pick flowers.
SPIKE,What? Yes I can!
OVERHEISER,(softly) Please be quiet.
HARMONY,Is it supposed to do that?
OVERHEISER,"Please. For god's sake, please, be quiet."
HARMONY,"Listen, buster. I don't see a crossbow in *your* hands, okay?"
SPIKE,"Harmony, if your incessant prattling bolloxes up this operation, I'm gonna personally yank out your pink and wriggly tongue."
HARMONY,What are you looking at?
BUFFY,Uh-oh.
RILEY,Graham. Graham. (Helps him sit up. Riley holds up two fingers) How many fingers I got?
GRAHAM,Seventeen.
GRAHAM,Hostile 17 and a blonde girl.
BUFFY,"(sighs) Spike and Harmony, together again."
GILES,Where's Dr. Overheiser?
BUFFY,"Uh, Spike must have taken him. What would Spike want with - (The clue hits) The chip. He's gonna force the doctor to remove the chip from his brain."
BUFFY,Riley?
RILEY,"(straightens up, breathlessly) I'm okay. Okay."
GRAHAM,"(to Buffy) We're running out of time. We don't find the medic soon, he's not gonna make it."
BUFFY,"(thinking fast) Okay, okay, brain surgery. He, he's gonna need a medical facility, he-he's gonna need, uh, uh, equipment..."
GRAHAM,This is a big hospital.
BUFFY,"No, uh-uh, he wouldn't do it here. It's too risky. We'll split up. Graham, get on the horn, or the ... pipe, or whatever you guys get on, I-I want you to check animal hospitals, doctors' offices..."
RILEY,"Hey, about before..."
GRAHAM,"We're good. Apologize later, if you're not dead."
BUFFY,(firmly) You are *not* going to die.
RILEY,Bet you say that to all the boys.
BUFFY,"No. There is one peroxided pest whose number is up. (They start to walk off) When I get my hands on Spike, I'm gonna rip his head off, I'm gonna..."
SPIKE,...bathe in the slayer's blood. Gonna dive in it. (with relish) Swim in it.
SPIKE,I'm gonna do the bloody backstroke.
HARMONY,"I see it, Spikey! I see the chip! It's nestled in there like ... a pretty little Easter egg with your brain all around it like that green plastic grassy stuff ... only this is more a beige, like-"
OVERHEISER,Would you please put out that cigarette? It's really not allowed.
HARMONY,Oh yeah? Says who?
HARMONY,"Oh god, sorry! Didn't see the sign!"
OVERHEISER,"The chip's out. (Harmony squeals excitedly) Didn't think I could do it, I just ... it's out."
SPIKE,Yeah?
HARMONY,"(jumping up and down, clapping) Yay! Yay for Spikey!"
SPIKE,"Right then. (determinedly) Stitch me up, doc. Got places to go. And slayers to kill."
SPIKE,"Listen to me. My stomach's growling, I'm so starved. (The doc looks nervous, begins to apply a bandage) I'm afraid I'm gonna have to have me a little snack."
SPIKE,"Oh, don't worry. I won't fill up on the bread. I'll still have plenty of room for the main course."
SPIKE,(fiercely) Slayer!
SPIKE,"Suit up, Harm."
BUFFY,Stay here. (She pushes him so he falls to the floor) We're gonna need you.
SPIKE,Buffy. I swear I was just thinking of you. I wanted to tell you the great news. My head's all clear now. No more bug-zapper in my noggin.
BUFFY,That means I get to kill you.
SPIKE,You get to try.
HARMONY,Oops.
SPIKE,At long last.
BUFFY,Riley!
BUFFY,Riley.
SPIKE,(looking at doctor) A penny?
OVERHEISER,(getting up) I told you I couldn't do it.
BUFFY,"Oh god. Doctor! Doctor, we need you *now*!"
SPIKE,"Buffy, Buffy, Buffy! Everywhere I turn, she's there! That nasty little face, that ... bouncing shampoo-commercial hair, that whole sodding holier-than-thou attitude."
HARMONY,"Well, aren't we kinda unholy, by the-"
SPIKE,"She follows me, you know, tracks me down. I'm her pet project. Drive Spike round the bend. Makes every day a fresh bout of torture."
HARMONY,Spike!
SPIKE,"You don't understand. I can't get rid of her. She's everywhere. She's haunting me, Harmony!"
SPIKE,(quietly) This ... has got to end.
OVERHEISER,All patched up.
BUFFY,How's it goin' in there?
RILEY,Good. Back to normal.
BUFFY,Yep.
BUFFY,And see ... I'm still touchable.
RILEY,"(nods) Give me a week or so to heal, and ... I'll take full advantage of that fact."
BUFFY,Are you gonna be okay? 'Cause I should really go check on my mom.
RILEY,"Yeah. Yeah, go ahead. I'll be fine."
BUFFY,I'll talk to you later.
GRAHAM,"It's a good thing Buffy found you when she did, 'cause you were about to detonate big-time. Always said she's pretty impressive."
RILEY,"You know, she really is."
GRAHAM,"But you know you don't belong here, right? (Keeps walking and talking although Riley has stopped walking and is staring at his back) This town? I mean, you're nothin' here."
RILEY,"Hey. (Graham stops walking, turns to look at him) What are you saying?"
GRAHAM,"Come on, man. You know it's true. There's nothing for you here."
RILEY,There's her.
GRAHAM,"Okay, right, there's her. And? You used to have a mission, and now you're what? The mission's boyfriend? Mission's true love?"
GRAHAM,You belong with us.
SPIKE,Should have known it's you. Been nearly six hours.
BUFFY,"Well, it would've been less if I wasn't busy cleaning up your mess."
SPIKE,"*My* mess? I just *borrowed* the doc. The mess is yours, Slayer. Yours and the boy's."
BUFFY,I'm done.
BUFFY,"Spike, you're a killer. And I shoulda done this *years* ago."
SPIKE,You know what? Do it. Bloody just do it.
BUFFY,What?
SPIKE,"End ... my ... torment. Seeing you, every day, everywhere I go, every time I turn around. Take me ... out of a world ... that has you in it! (Yanks off his shirt and throws it aside) Just kill me!"
BUFFY,(panting) Spike ... I want you.
SPIKE,"(muffled against her neck) Buffy, I love you."
SPIKE,"(OS) God, I love you so much."
SPIKE,"Oh, god, no."
SPIKE,"Please, no."
